{
  "plan_schema": "urn:kungfu-systems:build-images:comparator-qualification-plan:v1",
  "schema_version": 1,
  "test_only": true,
  "evidence_class": "containerized-user-outcome-qualification",
  "charter": {
    "id": "phase-a-test-charter",
    "version": "1",
    "sha256": "1111111111111111111111111111111111111111111111111111111111111111"
  },
  "fixture_set": {
    "id": "postgres-test-fixture",
    "sha256": "cccccccccccccccccccccccccccccccccccccccccccccccccccccccccccccccc"
  },
  "profile": "postgres",
  "configuration_slot": "realistic-default",
  "environment": {
    "compose_path": "compose.yaml",
    "compose_sha256": "9f050c11dc2374dd657e13b1852e799f612b8b8c4244d8fafdd43a8f555a9a85",
    "environment_lock_path": "environment.lock.json",
    "environment_lock_sha256": "d942c050ecd9e14596ea84de505d6b15e1351c74b48a0e3284bd5b8393e358ce",
    "runner_image": "ghcr.io/kungfu-systems/build-images/kungfu-verify@sha256:cb6d939d567c129903d6e3ad858e2c09a9475b3b8f81b1aad10279d0e63a920d"
  },
  "repetitions": 3,
  "scenarios": [
    {
      "id": "dump-restore-recovery",
      "job_id": "postgres-qualification",
      "steps": [
        {
          "id": "smoke",
          "action": "profile-smoke",
          "timeout_seconds": 1200,
          "oracles": [
            { "type": "exit-code", "expected": 0 },
            { "type": "artifact-exists", "path": "pilot/postgres-restore-value.txt", "expected": true },
            { "type": "artifact-text-contains", "path": "pilot/postgres-restore-value.txt", "expected": "seed" }
          ]
        }
      ]
    }
  ],
  "artifact_retention": {
    "destination": "qualification-tests/postgres",
    "required_patterns": [
      "raw/**/pilot/environment-manifest.json",
      "raw/**/pilot/postgres-restore-value.txt",
      "raw/**/pilot/docker-stats.jsonl",
      "raw/**/pilot/compose.log"
    ],
    "retention_days": 7
  },
  "claim_boundary": {
    "native_performance_authority": false,
    "user_outcome_qualification_authority_requested": true,
    "fresh_install_cost_authority": false,
    "final_scoring_authority": false
  }
}
