{
  "plan_schema": "urn:kungfu-systems:build-images:comparator-qualification-plan:v1",
  "schema_version": 1,
  "test_only": true,
  "evidence_class": "containerized-user-outcome-qualification",
  "charter": {
    "id": "phase-a-test-charter",
    "version": "1",
    "sha256": "1111111111111111111111111111111111111111111111111111111111111111"
  },
  "fixture_set": {
    "id": "aeron-test-fixture",
    "sha256": "aaaaaaaaaaaaaaaaaaaaaaaaaaaaaaaaaaaaaaaaaaaaaaaaaaaaaaaaaaaaaaaa"
  },
  "profile": "aeron",
  "configuration_slot": "realistic-default",
  "environment": {
    "compose_path": "compose.yaml",
    "compose_sha256": "1c0e8872402a110d7c0c1014c106491102f2e126574fe3a67e54765b4fbd1613",
    "environment_lock_path": "environment.lock.json",
    "environment_lock_sha256": "4f08255a001919e8db0c8f6c9936d49d5c7fed66ad5299240895c1323e390c66",
    "runner_image": "ghcr.io/kungfu-systems/build-images/kungfu-verify@sha256:cb6d939d567c129903d6e3ad858e2c09a9475b3b8f81b1aad10279d0e63a920d"
  },
  "repetitions": 3,
  "scenarios": [
    {
      "id": "archive-recovery",
      "job_id": "aeron-qualification",
      "steps": [
        {
          "id": "smoke",
          "action": "profile-smoke",
          "timeout_seconds": 1200,
          "oracles": [
            { "type": "exit-code", "expected": 0 },
            { "type": "artifact-exists", "path": "pilot/aeron-recording.txt", "expected": true },
            { "type": "artifact-text-contains", "path": "pilot/aeron-recording.txt", "expected": "aeron-record-receipt/v2" }
          ]
        }
      ]
    }
  ],
  "artifact_retention": {
    "destination": "qualification-tests/aeron",
    "required_patterns": [
      "raw/**/pilot/environment-manifest.json",
      "raw/**/pilot/aeron-recording.txt",
      "raw/**/pilot/docker-stats.jsonl",
      "raw/**/pilot/compose.log"
    ],
    "retention_days": 7
  },
  "claim_boundary": {
    "native_performance_authority": false,
    "user_outcome_qualification_authority_requested": true,
    "fresh_install_cost_authority": false,
    "final_scoring_authority": false
  }
}
